<?xml version="1.0" encoding="UTF-8"?>
<contrat-concession xmlns:xsi="http://www.w3.org/2001/XMLSchema-instance" xsi:noNamespaceSchemaLocation="https://raw.githubusercontent.com/etalab/format-commande-publique/master/sch%C3%A9mas/xml/contrats-concessions.xsd">
	<id>20010345211202</id>
	<autoriteConcedante>
		<siret>21350238800019</siret>
		<nom>Ville de Millau</nom>
	</autoriteConcedante>
	<nature>Concession de travaux</nature>
	<objet>Construction et exploitation d'un viaduc</objet>
	<procedure>Procédure négociée restreinte</procedure>
	<lieuExecution>
		<code>12145</code>
		<typeCode>Code INSEE commune</typeCode>
		<nom>Millau</nom>
	</lieuExecution>
	<dureeMois>360</dureeMois>
	<dateSignature>2001-02-21</dateSignature>
	<datePublicationDonnees>2001-02-21</datePublicationDonnees>
	<dateTransmissionDonneesEtalab>2007-08-07</dateTransmissionDonneesEtalab>
	<dateDebutExecution>2001-02-21</dateDebutExecution>
	<valeurGlobale>27860000</valeurGlobale>
	<montantSubventionPublique>2987000</montantSubventionPublique>
	<donneesExecution>
		<donneesAnnuelles>
			<datePublicationDonneesExecution>2002-03-30</datePublicationDonneesExecution>
			<depensesInvestissement>658000</depensesInvestissement>
			<tarifs>
				<tarif>
					<intituleTarif>Traversée du viaduc, véhicule léger</intituleTarif>
					<tarif>9.10</tarif>
				</tarif>
				<tarif>
					<intituleTarif>Traversée du viaduc, véhicule lourd</intituleTarif>
					<tarif>14.4</tarif>
				</tarif>
			</tarifs>
		</donneesAnnuelles>
	</donneesExecution>
	<concessionnaires>
		<concessionnaire>
			<typeIdentifiant>SIRET</typeIdentifiant>
			<id>81223113200026</id>
			<denominationSociale>Atlas SAS</denominationSociale>
		</concessionnaire>
	</concessionnaires>
	<modifications>
		<modification>
			<objetModification>Allongement de la durée</objetModification>
			<datePublicationDonneesModification>2002-01-19</datePublicationDonneesModification>
			<dateSignatureModification>2008-07-20</dateSignatureModification>
			<dureeMois>410</dureeMois>
		</modification>
		<modification>
			<objetModification>Allongement de la durée et révision de la valeur globale</objetModification>
			<dateSignatureModification>2008-07-20</dateSignatureModification>
			<datePublicationDonneesModification>2007-06-14</datePublicationDonneesModification>
			<dureeMois>540</dureeMois>
			<valeurGlobale>33890000</valeurGlobale>
		</modification>
	</modifications>
</contrat-concession>
